{"controls":[{"default":1.0,"id":"demand_scale","kind":"range","label":"Demand multiplier","max":1.6,"min":0.5,"options":null,"param_path":"params.demand_scale","step":0.05,"unit":"x"},{"default":1.0,"id":"freight_scale","kind":"range","label":"Freight rate multiplier","max":3.0,"min":0.5,"options":null,"param_path":"params.freight_scale","step":0.1,"unit":"x"},{"default":1.0,"id":"fixed_cost_scale","kind":"range","label":"Site fixed-cost multiplier","max":3.0,"min":0.25,"options":null,"param_path":"params.fixed_cost_scale","step":0.05,"unit":"x"},{"default":1.0,"id":"capacity_scale","kind":"range","label":"Site capacity multiplier","max":1.5,"min":0.25,"options":null,"param_path":"params.capacity_scale","step":0.05,"unit":"x"},{"default":14,"id":"max_open_sites","kind":"range","label":"Maximum open sites","max":14,"min":1,"options":null,"param_path":"params.max_open_sites","step":1,"unit":"sites"},{"default":[],"id":"closed_sites","kind":"multiselect","label":"Closed sites (outage)","max":null,"min":null,"options":["S00","S01","S02","S03","S04","S05","S06","S07","S08","S09","S10","S11","S12","S13"],"param_path":"params.closed_sites","step":null,"unit":""},{"default":false,"id":"relax","kind":"toggle","label":"Explain infeasibility (elastic relaxation)","max":null,"min":null,"options":null,"param_path":"params.relax","step":null,"unit":""}],"defaults":{"capacity_scale":1.0,"closed_lanes":[],"closed_sites":[],"demand_scale":1.0,"fixed_cost_scale":1.0,"fixed_open":null,"freight_scale":1.0,"max_open_sites":20,"relax":false},"formulation":{"constraints":["dem[d,k]: sum of x into node d for k (+ u[d,k]) = demand[d,k]","flw[f,k]: sum_p y[p,f,k] - sum_{a out of f} x[a,k] = 0 (no inventory)","cap[f]: sum_k w_k sum_{a out of f} x[a,k] - cap_f z_f (- so[f]) <= 0","sup[p,k]: sum_f y[p,f,k] (- sp[p,k]) <= supply[p,k]","lnk[a,k]: x[a,k] - demand[d(a),k] z[f(a)] <= 0 (tightening, does not change the optimum)","mxo: sum_f z[f] (- sm) <= max_open_sites","cls[f]: z[f] = 0 for closed sites; fix[f]: z[f] = 0|1 when a design is locked; closed lanes: x[a,k] = 0 in Bounds"],"objective":"min sum_f fixed_f z_f + sum_{a,k} (t_out[a,k] + handling_k) x[a,k] + sum_{p,f,k} t_in[p,f,k] y[p,f,k] (+ penalties on slack columns when relax = true)","relaxation":["Elastic slack columns are added only when params.relax is true. Penalties per unit: unmet demand 6000 USD/t, capacity overshoot 2500 USD/unit, plant supply overshoot 3500 USD/t, extra open site 3e+07 USD/site.","Each penalty exceeds any feasible marginal cost of the same quantity, so a slack is positive only when the strict model cannot be satisfied.","The relaxation report lists every slack above 0.0005, grouped by constraint family. Individual slack amounts can split differently between alternative optima; the total penalty and status are what is compared."],"summary":"Two-echelon capacitated fixed-charge facility location with multi-commodity flow: plants ship to open candidate sites, sites ship to demand nodes, every demand node must receive its demand for every commodity.","variables":["z[f] in {0,1}: site f open","x[a,k] >= 0 tons of commodity k on out-arc a (site to demand node)","y[p,f,k] >= 0 tons of commodity k from plant p to site f","relaxed only: u[d,k] unmet tons, so[f] capacity overshoot units, sp[p,k] supply overshoot tons, sm open-site excess"]},"generated_at":"2026-10-11T04:03:21Z","lp_format":{"column_order":["z[f] by site","x[a,k] by arc then commodity","y[p,f,k] by plant, site, commodity","relaxed only: u[d,k], so[f], sp[p,k], sm"],"names":"z{f}, x{a}_{k}, y{p}_{f}_{k}, u{d}_{k}, so{f}, sp{p}_{k}, sm; rows dem{d}_{k}, flw{f}_{k}, cap{f}, sup{p}_{k}, lnk{a}_{k}, mxo, cls{f}, fix{f}","note":"HiGHS orders columns by first appearance in the file; always map solution values back by column name.","number_format":"fixed 4 decimals, trailing zeros and dangling point stripped, -0 written 0, no exponent","rounding_rule":"r4(x) = floor(x * 10000 + 0.5) / 10000","row_order":["dem[d,k]","flw[f,k]","cap[f]","sup[p,k]","lnk[a,k]","mxo","cls[f] for closed sites","fix[f] for all sites when fixed_open is set"],"sections":"Minimize / Subject To / Bounds (closed lanes) / Binary (all z) / End; objective lists non-zero costs in column order"},"penalties":{"capacity_usd_unit":2500.0,"note":"Penalties are modelling devices for the relaxation, not costs; they are reported separately from operating cost.","open_sites_usd_site":30000000.0,"supply_usd_ton":3500.0,"unmet_usd_ton":6000.0},"presets":[{"description":"Minimum-cost open set and flows for the baseline synthetic network.","id":"optimized","kind":"design","label":"Optimized network","params":{"capacity_scale":1.0,"closed_lanes":[],"closed_sites":[],"demand_scale":1.0,"fixed_cost_scale":1.0,"fixed_open":null,"freight_scale":1.0,"max_open_sites":20,"relax":false}},{"description":"Sites fixed to the six largest host cities (S00 to S05); flows re-optimised for that fixed footprint.","id":"legacy","kind":"design","label":"Legacy footprint","params":{"capacity_scale":1.0,"closed_lanes":[],"closed_sites":[],"demand_scale":1.0,"fixed_cost_scale":1.0,"fixed_open":[0,1,2,3,4,5],"freight_scale":1.0,"max_open_sites":20,"relax":false}},{"description":"All demand scaled by 1.18 (still inside plant supply headroom), network re-optimised.","id":"demand_surge","kind":"design","label":"Demand +18%","params":{"capacity_scale":1.0,"closed_lanes":[],"closed_sites":[],"demand_scale":1.18,"fixed_cost_scale":1.0,"fixed_open":null,"freight_scale":1.0,"max_open_sites":20,"relax":false}},{"description":"All per ton-mile rates x1.6; the optimum opens more sites to shorten last-mile hauls.","id":"high_freight","kind":"design","label":"Freight rates x1.6","params":{"capacity_scale":1.0,"closed_lanes":[],"closed_sites":[],"demand_scale":1.0,"fixed_cost_scale":1.0,"fixed_open":null,"freight_scale":1.6,"max_open_sites":20,"relax":false}},{"description":"Open-site limit of 5.","id":"lean_sites","kind":"design","label":"At most 5 sites","params":{"capacity_scale":1.0,"closed_lanes":[],"closed_sites":[],"demand_scale":1.0,"fixed_cost_scale":1.0,"fixed_open":null,"freight_scale":1.0,"max_open_sites":5,"relax":false}},{"description":"Sites within 350 mi of Houston city closed; remaining optimized sites fixed; elastic relaxation shows what cannot be served.","id":"storm_optimized","kind":"stress","label":"Gulf storm on the optimized network","params":{"capacity_scale":1.0,"closed_lanes":[],"closed_sites":[3],"demand_scale":1.0,"fixed_cost_scale":1.0,"fixed_open":[0,1,2,4,5,8,10],"freight_scale":1.0,"max_open_sites":20,"relax":true}},{"description":"Same storm applied to the legacy footprint.","id":"storm_legacy","kind":"stress","label":"Gulf storm on the legacy footprint","params":{"capacity_scale":1.0,"closed_lanes":[],"closed_sites":[3],"demand_scale":1.0,"fixed_cost_scale":1.0,"fixed_open":[0,1,2,4,5],"freight_scale":1.0,"max_open_sites":20,"relax":true}},{"description":"Demand x1.4 exceeds plant supply (headroom 1.25): the strict model is infeasible.","id":"infeasible_supply","kind":"infeasible","label":"Demand +40% (strict)","params":{"capacity_scale":1.0,"closed_lanes":[],"closed_sites":[],"demand_scale":1.4,"fixed_cost_scale":1.0,"fixed_open":null,"freight_scale":1.0,"max_open_sites":20,"relax":false}},{"description":"Same instance with elastic slack: the report names the plant supply rows that must be exceeded.","id":"relaxed_supply","kind":"relaxed","label":"Demand +40% (relaxed)","params":{"capacity_scale":1.0,"closed_lanes":[],"closed_sites":[],"demand_scale":1.4,"fixed_cost_scale":1.0,"fixed_open":null,"freight_scale":1.0,"max_open_sites":20,"relax":true}},{"description":"Site capacity scaled to 30%: total capacity is below demand, strict model infeasible.","id":"infeasible_capacity","kind":"infeasible","label":"Capacity x0.3 (strict)","params":{"capacity_scale":0.3,"closed_lanes":[],"closed_sites":[],"demand_scale":1.0,"fixed_cost_scale":1.0,"fixed_open":null,"freight_scale":1.0,"max_open_sites":20,"relax":false}},{"description":"Same instance relaxed: capacity overshoot per site is reported.","id":"relaxed_capacity","kind":"relaxed","label":"Capacity x0.3 (relaxed)","params":{"capacity_scale":0.3,"closed_lanes":[],"closed_sites":[],"demand_scale":1.0,"fixed_cost_scale":1.0,"fixed_open":null,"freight_scale":1.0,"max_open_sites":20,"relax":true}},{"description":"Two sites cannot hold the demand: strict model infeasible.","id":"infeasible_sites","kind":"infeasible","label":"At most 2 sites (strict)","params":{"capacity_scale":1.0,"closed_lanes":[],"closed_sites":[],"demand_scale":1.0,"fixed_cost_scale":1.0,"fixed_open":null,"freight_scale":1.0,"max_open_sites":2,"relax":false}},{"description":"Same instance relaxed: the report says how many sites beyond the limit are needed.","id":"relaxed_sites","kind":"relaxed","label":"At most 2 sites (relaxed)","params":{"capacity_scale":1.0,"closed_lanes":[],"closed_sites":[],"demand_scale":1.0,"fixed_cost_scale":1.0,"fixed_open":null,"freight_scale":1.0,"max_open_sites":2,"relax":true}}],"schema_version":"v1","sizes":{"binaries":14,"columns":1640,"nonzeros":7780,"rows":1866},"solver":{"browser_note":"Python executed here; the browser build is exercised by tests/parity (node, same wasm build). Solve time in the browser is machine-dependent and reported in docs/TESTING.md.","highs_browser":"highs@1.15.3 (HiGHS-wasm)","highs_python":"highspy 1.15.1 (HiGHS 1.15.1)","options":{"mip_abs_gap":1e-06,"mip_rel_gap":0.0,"output_flag":false,"random_seed":0,"threads":1,"time_limit":60.0},"status_strings":{"infeasible":"Infeasible","optimal":"Optimal"}},"tags":{"controls":"SYNTHETIC","formulation":"SYNTHETIC","solver":"SYNTHETIC"}}
